{
  "adapterRef": {
    "id": "ADAPTER-SHARP-NORMALIZE-EXPORT@0.5.0",
    "implementationSha256": "ea521c4de76e18a0dae844686498b5d908fb0434eb9b8eeafffdfccbd57b71b1",
    "version": "0.5.0"
  },
  "artifactId": "normalized.s05.export.defect.014",
  "attempt": {
    "attemptNumber": 1,
    "idempotencyKey": "fixture-generation.normalized.s05.export.defect.014.r1.a1",
    "partition": "defect/calibration",
    "repetition": 1,
    "runId": "fixture-generation.normalized.s05.export.defect.014",
    "sourceId": "raw.s05.export.defect.014"
  },
  "bytes": {
    "byteLength": 450,
    "decodedPixelSha256": "0000000000000000000000000000000000000000000000000000000000000000",
    "fileSha256": "18dd57a3e8663e2bc4b57b55fcc0305a2b5e14eb55286861fd75e860ed8960e0",
    "mime": "image/png",
    "relativePath": "assets/open/export-defect/raw.s05.export.defect.014.png"
  },
  "candidateRef": {
    "contentHash": "bdd132233878decdf009919927290f1ba230d449f564d1b454966a33134acc8c",
    "id": "REG-NORM-SHARP@0.5.0"
  },
  "capabilityContractRef": {
    "contentHash": "48c3a5ec40798289ed66605ffdd80d08acdb8c8910540727a5f4ed08574beb01",
    "id": "CC-CAP02-NORMALIZE-PNG@0.5.0"
  },
  "contentHash": "9a8ccd90aad195246e0b868024c6a17c7511e183066b7fffbc6f3c9ff30022d2",
  "createdAt": "2026-08-15T04:23:38.389Z",
  "hardwareRef": {
    "contentHash": "634ec49c338b7cff36b0d012070620b1b8b38cc9031cdc54f678619ade35528b",
    "id": "HARDWARE-WIN32-X64@0.5.0"
  },
  "image": {
    "alphaMode": "straight-unpremultiplied",
    "alphaPresent": false,
    "animation": "forbidden",
    "colorSpace": "embedded-sRGB",
    "height": 9,
    "interlace": "forbidden",
    "metadataPolicy": "strip-all-except-color-contract",
    "orientation": 1,
    "pixelLayout": "RGBA8",
    "pngFilterPolicy": "filter-0-only",
    "width": 10
  },
  "operation": "normalize",
  "parent": {
    "sourceAssetId": "raw.s05.export.defect.014",
    "sourceDecodedPixelSha256": "f313d973e1189dd6a54fb13f9236ea27722849ccee16fc2556f49a230c3a3599",
    "sourceFileSha256": "18dd57a3e8663e2bc4b57b55fcc0305a2b5e14eb55286861fd75e860ed8960e0",
    "sourceManifestSha256": "55cd87f551226383c52f00f93bf01296af6f64185cd392f669c616e08fe9392f"
  },
  "producerRef": {
    "id": "GEN-INDEPENDENT-OPEN-PNG@0.5.0",
    "implementationSha256": "bb636fc7cc9ab98c569a0d8d05ad0c27eaecbe6121762c2e19921258b25ff18d",
    "kind": "independent-fixture-generator",
    "version": "0.5.0"
  },
  "runtimeRef": {
    "contentHash": "8cc1073efbe5458aec8c49091554337061d64ebfa0fdb2654e0f3b2f89c18e47",
    "id": "RUNTIME-SHARP-WIN32-X64@0.5.0"
  },
  "schemaVersion": "normalized-image.slice04.v0"
}
